,id,question,formatted_answer
455,688,"帮我算一下在20211108,代码为00159的港股日价格振幅是多少，小数点后保留不超过3位。","在20211108，代码为00159的港股日价格振幅是""no such column: 元""，小数点后保留不超过3位。"
456,689,2021年一季度，有多少家基金发生了净赎回?总共赎回了多少份额?记得给我四舍五入到小数点后两位哦。,2021年一季度，共有4337家基金发生了净赎回，总共赎回了3686507876467.15份额。
457,690,请帮我查询下股票代码为002560的股票在2020年内最高日收盘价是多少？,股票代码为002560的股票在2020年内的最高日收盘价是11.72。
458,695,请查询在2021年度，688656股票涨停天数？   解释：（收盘价/昨日收盘价-1）》=9.8% 视作涨停,在2021年度，688656股票涨停的天数为4天。
459,698,"帮我算一下在20190828,代码为08613的港股日价格振幅是多少，小数点后保留不超过3位。",在20190828，代码为08613的港股日价格振幅是no such column: 元。
460,706,我想知道2020年的中期报告中，机构投资者持有的份额占比超过75%的基金有多少，并且他们总共持有了多少?记得帮我保留两位小数。,根据2020年的中期报告，超过75%的基金中，机构投资者持有的份额占比为1481，他们总共持有了25956586921.65。
461,707,20200424日，一级行业为汽车的股票的成交金额合计是多少？取整。,20200424日，一级行业为汽车的股票的成交金额合计是0元。
462,708,民生加银睿智一年定期开放债券基金在20200930的季报里，前三大持仓占比的债券名称是什么?,在20200930的季报中，民生加银睿智一年定期开放债券基金的前三大持仓占比的债券名称分别是什么？
463,709,请帮我计算，代码为600510的股票，2020年一年持有的年化收益率有多少？百分数请保留两位小数。年化收益率定义为：（（有记录的一年的最终收盘价-有记录的一年的年初当天开盘价）/有记录的一年的当天开盘价）* 100%。,"要计算代码为600510的股票在2020年的年化收益率，我们需要知道2020年的年初当天开盘价和年末收盘价。然后，我们可以使用以下公式来计算年化收益率：（（年末收盘价-年初当天开盘价）/年初当天开盘价）* 100%。

请提供2020年的年初当天开盘价和年末收盘价，我将帮您计算出年化收益率。"
464,710,我想知道2020年的中期报告中，机构投资者持有的份额占比超过30%的基金有多少，并且他们总共持有了多少?记得帮我保留两位小数。,"根据2020年的中期报告，超过30%的基金中有1802只基金的份额被机构投资者持有，他们总共持有了804,723,52535.8元。"
