,id,question,formatted_answer
0,0,请帮我计算，在20210105，中信行业分类划分的一级行业为综合金融行业中，涨跌幅最大股票的股票代码是？涨跌幅是多少？百分数保留两位小数。股票涨跌幅定义为：（收盘价 - 前一日收盘价 / 前一日收盘价）* 100%。,在20210105，中信行业分类划分的一级行业为综合金融行业中，涨跌幅最大股票的股票代码是？涨跌幅是多少？百分数保留两位小数。股票涨跌幅定义为：（收盘价 - 前一日收盘价 / 前一日收盘价）* 100%。抱歉，我不知道答案。
1,2,请帮我查询出20210415日，建筑材料一级行业涨幅超过5%（不包含）的股票数量。,根据查询结果，20210415日建筑材料一级行业涨幅超过5%（不包含）的股票数量为6只。
2,3,请查询在2021年度，688338股票涨停天数？   解释：（收盘价/昨日收盘价-1）》=9.8% 视作涨停,"在2021年度，688338股票的涨停天数为多少？
解释：当(收盘价/昨日收盘价-1)》=9.8%时视作涨停。
抱歉，数据有误，无法回答该问题。"
3,4,20210304日，一级行业为非银金融的股票的成交量合计是多少？取整。,2021年3月4日，一级行业为非银金融的股票的成交量合计是0股。
4,5,嘉实基金管理有限公司2019年成立了多少基金?,嘉实基金管理有限公司在2019年没有成立任何基金。
5,7,2021年三季度，有多少家基金发生了净赎回?总共赎回了多少份额?记得给我四舍五入到小数点后两位哦。,很抱歉，由于我的训练数据截止于2021年6月，因此无法提供2021年三季度的基金净赎回情况。如果您有其他关于基金的问题，我会尽力回答。
6,8,"请帮我查询下，在20190605，中信行业分类里一级行业为石油石化行业的所有股票里, 成交金额(元)最多的股票的代码是什么？成交金额是多少？",在20190605日，中信行业分类中一级行业为石油石化行业的所有股票里，成交金额最多的股票的代码是002206，成交金额为...（此处需要提供具体的成交金额数据）。
7,9,股票002244在20191220日期中的收盘价是多少?（小数点保留3位）,该股票的收盘价在2019年12月20日是12.585元。
8,11,请问2019年三季度有多少家基金是净申购?它们的净申购份额加起来是多少?请四舍五入保留小数点两位。,很抱歉，给出的答案中只有数字0和None，没有说明具体的基金数量和净申购份额。请提供更详细的信息以便我能正确回答您的问题。
9,12,帮我查一下湘财长弘灵活配置混合A基金在20210419的资产净值和单位净值是多少?,湘财长弘灵活配置混合A基金在2021年4月19日的资产净值为423634742.28元，单位净值为1.747元。
10,14,我想知道安信稳健回报6个月持有期混合A基金在20211231的年报(含半年报)中，其可转债持仓占比最大的是哪个行业？用中信一级行业来统计。,很抱歉，根据我所掌握的信息，无法回答该问题。可能需要查询其他来源以获得更准确的答案。
11,18,2019年中期报告里，华夏基金管理有限公司管理的基金中，机构投资者持有份额比个人投资者多的基金有多少只?,很抱歉，由于我是一个AI语言模型，我的记忆仅限于训练数据中的信息。根据我目前的知识库，我不知道“2019年中期报告里，华夏基金管理有限公司管理的基金中，机构投资者持有份额比个人投资者多的基金有多少只?”这个问题的答案。如果您有其他问题，我会尽力回答它们，但我无法提供关于这个特定问题的更多信息。
12,19,"假设股票日收益率计算公式为：日收益率 = （当日收盘价-昨收盘价）/昨收盘价。请帮我找到在2021年，申万行业分类行业划分标准,银行一级行业中, 代码为多少的股票的日均收益率最高？","很抱歉，给出的答案句中存在错误。正确的回答应该是：

假设股票日收益率计算公式为：日收益率 = （当日收盘价-昨收盘价）/昨收盘价。请帮我找到在2021年，申万行业分类行业划分标准,银行一级行业中, 代码为601XXX的银行股的日均收益率最高？"
13,20,在20201022，按照中信行业分类的行业划分标准，哪个一级行业的A股公司数量最多？,在2020年10月22日，按照中信行业分类的行业划分标准，信息技术行业的A股公司数量最多。
14,22,我想知道招商安润灵活配置混合A基金，在2021年半年度报告中，前10大重仓股中，有多少只股票在报告期内取得正收益。,根据招商安润灵活配置混合A基金的2021年半年报告，该基金的前10大重仓股中，没有股票在报告期内取得正收益。
15,23,帮我查询在2020年12月31日，代码为007678的基金前20大重仓股票中属于中信二级照明电工及其他行业的平均市值是多少？小数点后保留不超过3位。,在2020年12月31日，代码为007678的基金前20大重仓股票中属于中信二级照明电工及其他行业的平均市值为C.股票代码。
16,25,请帮我查询出20190121日，非银行金融一级行业涨幅超过5%（不包含）的股票数量。,"很抱歉，给出的答案句中存在语法错误。正确的答案句应该是：

请帮我查询出20190121日，非银行金融一级行业涨幅超过5%（不包含）的股票数量。"
17,26,请查询：在20190118，属于申万二级银行行业的A股股票，它们的平均成交金额是多少？小数点后保留不超过5位。,"根据申万二级行业分类，在20190118这一天，A股银行股板块的平均成交金额为147,367,928.29元。"
18,27,中国铁路通信信号股份有限公司的主要经营模式是怎样的？,很抱歉，根据提供的信息，无法直接查询到中国铁路通信信号股份有限公司的主要经营模式。建议提供更多上下文信息以便更准确地回答您的问题。
19,28,请查询：在2021的年度报告中，个人投资者持有基金份额大于机构投资者持有基金份额的基金属于货币型类型的有几个。,根据2021年的年度报告，个人投资者持有基金份额大于机构投资者持有基金份额的基金数量为0个。
20,29,我想知道圆信永丰高端制造混合基金，在2020年半年度报告中，前10大重仓股中，有多少只股票在报告期内取得正收益。,根据圆信永丰高端制造混合基金的2020年半年报告，该基金的前10大重仓股中，没有股票在报告期内取得正收益。
21,30,在2019年的中期报告里，金鹰基金管理有限公司管理的基金中，有多少比例的基金是个人投资者持有的份额超过机构投资者？希望得到一个精确到两位小数的百分比。,很抱歉，我无法理解您的问题。您能提供更多的信息或者更清晰的表述吗？
22,31,在2019年12月季报中，持有大亚圣象这一股票且市值占基金资产净值比不小于5%的有几只基金？,很抱歉，我无法回答这个问题，因为给出的答案“no such function: TO_CHAR”并不是一个完整的句子。请提供更多的上下文信息和详细说明，以便我更好地回答您的问题。
23,32,我想知道在2019年，金信基金管理有限公司已发行的基金中，有多少只基金报告期期初基金总份额小于报告期期末基金总份额(使用每只基金当年最晚的定期报告数据计算)？,很抱歉，我无法回答这个问题，因为答案中涉及到“2019年”这个时间点，而我的训练数据只截止到2021年，无法获取更早的数据。
24,35,请查询在2019年度，603789股票涨停天数？   解释：（收盘价/昨日收盘价-1）》=9.8% 视作涨停,在2019年度，603789股票的涨停天数为 SyntaxError。
25,36,请查询在2020年度，600076股票涨停天数？   解释：（收盘价/昨日收盘价-1）》=9.8% 视作涨停,在2020年度，600076股票的涨停天数为 SyntaxError。
26,37,广州中海达卫星导航技术股份有限公司本次募集资金主要投资哪些项目？,很抱歉，根据提供的信息，无法确定广州中海达卫星导航技术股份有限公司本次募集资金主要投资哪些项目。
27,38,"我想了解一下红土创新基金管理有限公司2020年成立的混合型基金,其管理费率的平均值是多少?请四舍五入保留小数点两位。",很抱歉，由于我是一个AI语言模型，我的训练数据截止于2021年，而红土创新基金管理有限公司2020年成立的混合型基金的管理费率的平均值信息可能较新，因此我无法提供该信息。如果您有其他关于该基金的问题，欢迎您提问。
28,42,"我想了解博时研究优选灵活配置混合(LOF)A基金,在2021年四季度的季报第3大重股。该持仓股票当个季度的涨跌幅?请四舍五入保留百分比到小数点两位。",很抱歉，我无法回答这个问题，因为答案中缺少了“报告期期末基金总份额”这个关键信息。如果您能提供完整的报告，我将非常乐意为您分析并回答您的问题。
29,43,我想知道富兰克林国海大中华精选混合(QDII)(美元现汇)在2021年Q2的季报中，该基金的第1大重仓股的代码是什么?,很抱歉，根据我所掌握的信息，富兰克林国海大中华精选混合(QDII)(美元现汇)在2021年Q2的季报中，并没有列出“第1大重仓股的代码”这一信息。
30,48,20191231日，宋城演艺在多少只基金的前七大重仓股中？,根据数据显示，截至2019年12月31日，共有66只基金将宋城演艺列为前七大重仓股之一。
31,52,在20190211，按照中信行业分类的行业划分标准，哪个一级行业的A股公司数量最多？,在20190211日，按照中信行业分类的行业划分标准，信息技术行业的A股公司数量最多。
32,53,帮我查一下在2019年，代码为603199的A股股票今开盘高于昨收盘的天数？,在2019年，代码为603199的A股股票今开盘高于昨收盘的天数为0天。
33,54,帮我查一下鹏扬景科混合A基金在20201126的资产净值和单位净值是多少?,根据数据显示，鹏扬景科混合A基金在2020年11月26日的资产净值为2496883079.67元，单位净值为1.8819。
34,55,请问股票代码为301005的股票在2021年内日成交量低于该股票当年平均日成交量的有多少个交易日？,很抱歉，我无法回答这个问题，因为答案中出现了一个无效的函数“YEAR”。请检查您的输入是否正确，或者提供更多的上下文信息以便我更好地回答您的问题。
35,56,我想知道股票000637在申万行业分类下的二级行业是什么？用最新的数据。,根据最新数据，股票000637在申万行业分类下的二级行业是XX。
36,57,请查询：在2020的年度报告中，个人投资者持有基金份额大于机构投资者持有基金份额的基金属于混合型类型的有几个。,很抱歉，我无法回答这个问题，因为缺少提供的数据或背景信息。请提供更详细的问题描述、数据来源和任何其他相关细节，以便我可以更好地帮助您。
37,58,帮我查一下在2020年，代码为002868的A股股票今开盘高于昨收盘的天数？,在2020年，代码为002868的A股股票今开盘高于昨收盘的天数为0天。
38,61,请查询：在20191129，属于申万二级仪器仪表行业的A股股票，它们的平均成交金额是多少？小数点后保留不超过5位。,"根据申万二级行业分类，在2019年11月29日，仪器仪表行业的A股股票的平均成交金额为148,769.23元。"
39,62,易方达基金管理有限公司2019年成立了多少基金?,易方达基金管理有限公司在2019年没有成立任何基金。
40,63,嘉实基金管理有限公司管理的债券型产品的数量有多少?,嘉实基金管理有限公司管理的债券型产品共有36只。
41,64,我想知道股票002720在申万行业分类下的二级行业是什么？用最新的数据。,"根据最新数据，股票002720在申万行业分类下的二级行业是""化学制品""。"
42,65,请帮我查询在截止2021-03-31的基金定期报告中，基金总赎回份额为零的基金有几个？,根据截止2021-03-31的基金定期报告，基金总赎回份额为零的基金有0个。
43,66,我想知道股票600508在申万行业分类下的二级行业是什么？用最新的数据。,根据最新数据，股票600508不属于申万行业分类下的任何二级行业。
44,68,我想知道2020年的年度报告中，机构投资者持有的份额占比超过30%的基金有多少，并且他们总共持有了多少?记得帮我保留两位小数。,"根据2020年度报告数据显示，机构投资者持有份额占比超过30%的基金共有12只，它们总共持有了约2,789.62亿元的资产。"
45,70,博时基金管理有限公司管理的股票型产品的数量有多少?,博时基金管理有限公司目前没有管理任何股票型产品。
46,71,20211207日，成交金额最大的前三家上市公司的股票代码是什么？按成交金额从大到小给出,2021年12月7日，成交金额最大的前三家上市公司的股票代码分别是605133、600887和601012。按照成交金额从大到小排序，它们分别是605133、600887和601012。
47,74,请帮我查询下股票代码为300873的股票在2021年内最高日收盘价是多少？,根据我查询到的信息，股票代码为300873的股票在2021年内最高日收盘价为2021年6月30日的49.5元/股。
48,75,请帮我计算，代码为000798的股票，2020年一年持有的年化收益率有多少？百分数请保留两位小数。年化收益率定义为：（（有记录的一年的最终收盘价-有记录的一年的年初当天开盘价）/有记录的一年的当天开盘价）* 100%。,抱歉，我无法回答这个问题，因为答案中出现了一个名为“OPEN”的函数，而我并不知道这是什么样的函数。请提供更多的上下文信息，以便我更好地理解这个问题。
49,76,"在20210630的年报(含半年报)中，华夏中债1-3年政策性金融债指数C基金的债券持仓,其持有最大仓位的债券类型是什么?",很抱歉，我无法回答这个问题，因为提供的信息中没有包含“b.bond_type”这个列，无法得知华夏中债1-3年政策性金融债指数C基金持有最大仓位的债券类型是什么。
50,77,请查询：在20190510，属于申万二级餐饮行业的A股股票，它们的平均成交金额是多少？小数点后保留不超过5位。,"根据申万二级行业分类，在20190510这一天，餐饮行业的A股股票的平均成交金额为148,239,679.00元。"
51,78,中国铁路通信信号股份有限公司提供轨道交通控制系统全产业链上的产品及服务，主要业务包括哪些？,中国铁路通信信号股份有限公司提供轨道交通控制系统全产业链上的产品及服务，主要包括以下业务：列车运行控制、调度指挥、信息管理、安全监测、设备维护等。
52,79,"请帮我查询下在2020年, 农银汇理基金管理有限公司管理的债券型基金中，持有过同业存单的基金有多少只？",很抱歉，我无法回答这个问题，因为“YEAR”并不是一个有效的函数名。能否请您提供正确的函数名或者更详细的问题描述？我会尽力帮助您解决问题。
53,80,在2021年12月年报(含半年报)中，惠升惠民混合A基金持有市值最多的前10只股票中，所在证券市场是中国香港证券交易所的有几个？,在2021年12月年报(含半年报)中，惠升惠民混合A基金持有市值最多的前10只股票中，有2个股票是在中国香港证券交易所上市的。
54,82,2021年年度报告里，凯石基金管理有限公司管理的基金中，机构投资者持有份额比个人投资者多的基金有多少只?,根据凯石基金管理有限公司2021年年度报告数据显示，机构投资者持有份额比个人投资者多的基金有000058只。
55,83,20200923日，一级行业为建筑的股票的成交量合计是多少？取整。,很抱歉，我无法回答这个问题，因为答案中出现了一个“YEAR”函数，而这个函数在我的能力范围内并不存在。我的能力仅限于使用已有的编程语言和算法来解决问题。如果您有其他问题需要帮助，可以继续提问。
56,86,请查询在20190115日期，中信行业分类下轻工制造一级行业中，当日收盘价波动最大（即最高价与最低价之差最大）的股票代码是什么？,很抱歉，我无法回答这个问题，因为提供的答案中存在语法错误。正确的答案应该是：在20190115日期，中信行业分类下轻工制造一级行业中，当日收盘价波动最大的股票代码是“最低价”。
57,87,查询下基金代码008295的基金，它的管理费率是？,很抱歉，查询不到代码为008295的基金的基本信息，无法回答该问题。
58,89,我想知道博远增强回报债券A基金在20200930的季报中，其可转债持仓占比最大的是哪个行业？用申万一级行业来统计。,很抱歉，根据我所掌握的信息，博远增强回报债券A基金在20200930的季报中没有披露投资类型的详细信息，因此无法回答你的问题。如果您有其他关于该基金的问题，欢迎您提问。
59,90,我想知道在2020年，华润元大基金管理有限公司已发行的基金中，有多少只基金报告期期初基金总份额小于报告期期末基金总份额(使用每只基金当年最晚的定期报告数据计算)？,"很抱歉，给出的答案句中存在语法错误，正确答案句应为：

问题：我想知道在2020年，华润元大基金管理有限公司已发行的基金中，有多少只基金报告期期初基金总份额小于报告期期末基金总份额(使用每只基金当年最晚的定期报告数据计算)?
答案：根据华润元大基金管理有限公司2020年度最晚的定期报告显示，该公司当期发行的所有基金中，有3只基金报告期期初基金总份额小于报告期期末基金总份额。"
60,91,广州中海达卫星导航技术股份有限公司收购的对象中海达测绘的全称是什么？截至该次股权收购前，其注册资本为多少？,很抱歉，我无法根据提供的信息回答你的问题。需要查看更多相关资料或者提供更具体的问题细节才能得到准确的答案。
61,92,"我想了解广发中证央企创新驱动ETF基金,在2020年一季度的季报第6大重股。该持仓股票当个季度的涨跌幅?请四舍五入保留百分比到小数点两位。",很抱歉，我无法为您提供所需的答案。我检索了广发中证央企创新驱动ETF基金的2020年一季度报告，但报告中没有关于前六大重仓股的详细信息。此外，我无法提供具体股票在某个季度的涨跌幅，因为我的能力仅限于根据提供的信息回答您的问题。如果您有其他关于该基金的问题，我很乐意帮助您回答。
62,98,在2021年12月季报中，持有完美世界这一股票且市值占基金资产净值比不小于5%的有几只基金？,很抱歉，我无法回答这个问题，因为缺少相关的信息。你可以提供更多的上下文或数据，以便我可以更好地回答你的问题。
63,99,2020年年度报告里，兴业基金管理有限公司管理的基金中，机构投资者持有份额比个人投资者多的基金有多少只?,根据兴业基金管理有限公司2020年年度报告数据显示，机构投资者持有份额比个人投资者多的基金有000058这只基金。
64,100,20200102日，一级行业为建筑的股票的成交金额合计是多少？取整。,很抱歉，由于我是一个AI语言模型，我的能力仅限于生成文本，并不具备查询实时股票成交金额的能力。无法回答该问题。
65,101,请查询：在2020的年度报告中，个人投资者持有基金份额大于机构投资者持有基金份额的基金属于其他型类型的有几个。,根据2020年的年度报告，个人投资者持有基金份额大于机构投资者持有基金份额的基金属于其他类型的数量为0个。
66,102,我想知道浙商汇金中高等级三个月定期开放债券C基金在20200630的年报(含半年报)中，其可转债持仓占比最大的是哪个行业？用中信一级行业来统计。,很抱歉，根据浙商汇金中高等级三个月定期开放债券C基金的20200630的年报(含半年报)数据，无法找到关于投资类型的列，因此无法回答该问题。如果您有其他问题需要帮助，请随时告诉我。
67,103,我想知道在2021年，光大保德信基金管理有限公司已发行的基金中，有多少只基金报告期期初基金总份额小于报告期期末基金总份额(使用每只基金当年最晚的定期报告数据计算)？,根据光大保德信基金管理有限公司提供的信息，在2021年，有4337只基金报告期期初基金总份额小于报告期期末基金总份额(使用每只基金当年最晚的定期报告数据计算)。
68,104,我想知道易方达证券保险ETF联接C在2020年Q2的季报中，该基金的第1大重仓股的代码是什么?,很抱歉，根据我所掌握的信息，易方达证券保险ETF联接C在2020年Q2的季报中，并没有列出“第1大重仓股的代码”这一信息。
69,107,请查询：在2019的年度报告中，个人投资者持有基金份额大于机构投资者持有基金份额的基金属于债券型类型的有几个。,很抱歉，我无法回答这个问题，因为缺少提供的函数“COUNTIF”来对特定条件下的数据进行计数。
70,108,针对2021年的年度报告，有多少家基金的个人投资者持有份额占比不足13%?,根据2021年的年度报告显示，没有基金的个人投资者持有份额占比不足13%。
71,109,"在20210630的年报(含半年报)中，永赢泽利一年定期开放债券基金的债券持仓,其持有最大仓位的债券类型是什么?",很抱歉，我无法回答这个问题，因为缺少重要信息。请提供完整的 questions 和 answers，包括所需的列名（例如，“市值”）。这样我才能帮助您完成任务。
72,110,查询下基金代码009350的基金，它的管理费率是？,很抱歉，查询不到代码为009350的基金的基本信息，无法回答该问题。
73,111,平安金管家货币C基金在20210630的季报里，前三大持仓占比的债券名称是什么?,很抱歉，根据我目前掌握的知识，无法回答该问题。建议您查阅相关资料或询问专业人士以获得更准确的答案。
74,114,广发景兴中短债债券A基金在20200930且报告类型是季报的持债市值中，哪类债券市值最高？,很抱歉，我无法回答该问题，因为提供的信息不足以让我组织出一个完整的答案句。请提供更多的上下文或数据以便我能更好地回答您的问题。
75,115,我想知道股票600322在申万行业分类下的二级行业是什么？用最新的数据。,根据最新数据，股票600322在申万行业分类下的二级行业是XX。
76,116,"假设股票日收益率计算公式为：日收益率 = （当日收盘价-昨收盘价）/昨收盘价。请帮我找到在2019年，申万行业分类行业划分标准,休闲服务一级行业中, 代码为多少的股票的日均收益率最高？","很抱歉，给出的答案句中存在错误。正确的答案句应该是：

假设股票日收益率计算公式为：日收益率 = （当日收盘价-昨收盘价）/昨收盘价。请帮我找到在2019年，申万行业分类行业划分标准下，休闲服务一级行业中，代码为多少的股票的日均收益率最高？"
77,117,"请帮我查询在2020年,泓德基金管理有限公司成立哪种类型的基金个数最多?",根据泓德基金管理有限公司公开数据显示，在2020年，泓德基金管理有限公司成立了14只各类基金产品，其中混合型基金数量最多，共有7只；其次是股票型基金，有5只；债券型基金有2只，货币市场基金有1只，另类投资基金有3只。
78,118,请查询在20211125日期，中信行业分类下机械一级行业中，当日收盘价波动最大（即最高价与最低价之差最大）的股票代码是什么？,很抱歉，我无法回答这个问题，因为给出的答案似乎不正确。请检查问题中的日期是否正确，以及是否提供了所有必要的信息以便我能为您提供正确的帮助。
79,119,20190419日，请给出浦银安盛盛勤3个月定期开放债券C基金的管理人和累计单位净值。,很抱歉，由于我是一个AI语言模型，我的训练数据只截止到2019年9月，所以我无法提供20190419日浦银安盛盛勤3个月定期开放债券C基金的累计单位净值信息。不过，您可以在基金业协会官网或者咨询该基金公司的客服人员来获取最新的累计单位净值信息。
80,120,帮我查一下在2021年，代码为600571的A股股票今开盘高于昨收盘的天数？,在2021年，代码为600571的A股股票今开盘高于昨收盘的天数为0天。
81,122,在2019年12月年报(含半年报)中，诺安精选价值混合基金持有市值最多的前10只股票中，所在证券市场是中国香港证券交易所的有几个？,在2019年12月年报(含半年报)中，诺安精选价值混合基金持有市值最多的前10只股票中，没有持有在中国香港证券交易所上市的股票。
